{
  "total_languages": 1051,
  "note": "MMTEB covers 1051 languages in ISO 639-3 codes across all tasks (250+ excluding bitext mining). The top 100 languages by task count are listed in the paper's Table 8 (Appendix D.2). The massive language count is driven primarily by BibleNLPBitextMining (829 languages) and FloresBitextMining (200+ languages). For non-bitext-mining tasks, language coverage is heavily skewed toward high-resource languages. The distribution is skewed: English has 303 tasks, German 58, French 57, Russian 52, while many low-resource languages have only 1-3 tasks (primarily bitext mining and classification).",
  "language_families_represented": [
    "Indo-European",
    "Afro-Asiatic",
    "Atlantic-Congo",
    "Sino-Tibetan",
    "Austronesian",
    "Dravidian",
    "Turkic",
    "Uralic",
    "Austroasiatic",
    "Tai-Kadai",
    "Japonic",
    "Koreanic",
    "Kartvelian"
  ],
  "top_languages_by_task_count": {
    "eng": {"name": "English", "family": "Indo-European", "tasks": 303},
    "deu": {"name": "German", "family": "Indo-European", "tasks": 58},
    "fra": {"name": "French", "family": "Indo-European", "tasks": 57},
    "rus": {"name": "Russian", "family": "Indo-European", "tasks": 52},
    "pol": {"name": "Polish", "family": "Indo-European", "tasks": 46},
    "cmn": {"name": "Mandarin Chinese", "family": "Sino-Tibetan", "tasks": 44},
    "spa": {"name": "Spanish", "family": "Indo-European", "tasks": 43},
    "hin": {"name": "Hindi", "family": "Indo-European", "tasks": 38},
    "jpn": {"name": "Japanese", "family": "Japonic", "tasks": 35},
    "kor": {"name": "Korean", "family": "Koreanic", "tasks": 29},
    "ara": {"name": "Arabic", "family": "Afro-Asiatic", "tasks": 28},
    "ben": {"name": "Bengali", "family": "Indo-European", "tasks": 28},
    "ita": {"name": "Italian", "family": "Indo-European", "tasks": 27},
    "por": {"name": "Portuguese", "family": "Indo-European", "tasks": 27},
    "tel": {"name": "Telugu", "family": "Dravidian", "tasks": 24},
    "dan": {"name": "Danish", "family": "Indo-European", "tasks": 23},
    "swe": {"name": "Swedish", "family": "Indo-European", "tasks": 22},
    "ind": {"name": "Indonesian", "family": "Austronesian", "tasks": 21},
    "tam": {"name": "Tamil", "family": "Dravidian", "tasks": 21},
    "tha": {"name": "Thai", "family": "Tai-Kadai", "tasks": 21},
    "mar": {"name": "Marathi", "family": "Indo-European", "tasks": 20},
    "fin": {"name": "Finnish", "family": "Uralic", "tasks": 19},
    "kan": {"name": "Kannada", "family": "Dravidian", "tasks": 19},
    "mal": {"name": "Malayalam", "family": "Dravidian", "tasks": 19},
    "nld": {"name": "Dutch", "family": "Indo-European", "tasks": 19},
    "tur": {"name": "Turkish", "family": "Turkic", "tasks": 19},
    "urd": {"name": "Urdu", "family": "Indo-European", "tasks": 19},
    "yor": {"name": "Yoruba", "family": "Atlantic-Congo", "tasks": 16},
    "swa": {"name": "Swahili", "family": "Atlantic-Congo", "tasks": 15},
    "amh": {"name": "Amharic", "family": "Afro-Asiatic", "tasks": 14},
    "hau": {"name": "Hausa", "family": "Afro-Asiatic", "tasks": 14},
    "ibo": {"name": "Igbo", "family": "Atlantic-Congo", "tasks": 12},
    "kat": {"name": "Georgian", "family": "Kartvelian", "tasks": 10},
    "xho": {"name": "Xhosa", "family": "Atlantic-Congo", "tasks": 10},
    "zul": {"name": "Zulu", "family": "Atlantic-Congo", "tasks": 7}
  },
  "scripts_represented": "Not explicitly enumerated in paper; metadata includes ISO 15924 script codes (e.g., Latn, Cyrl, Deva, Beng, Arab, CJK scripts, etc.) per language",
  "constructed_benchmarks": {
    "MTEB(Multilingual)": {"tasks": 132, "languages": "250+"},
    "MTEB(Europe)": {"tasks": 74, "languages": "56 official EU/Schengen languages"},
    "MTEB(Indic)": {"tasks": 23, "languages": "30 Indic languages"},
    "MTEB(eng, v2)": {"tasks": 41, "languages": "English"},
    "MTEB(Code)": {"tasks": 10, "languages": "Programming languages + English"},
    "MTEB(rus)": {"tasks": 18, "languages": "Russian"},
    "MTEB(Scandinavian)": {"tasks": null, "languages": "Scandinavian languages"},
    "MTEB(fra)": {"tasks": null, "languages": "French"},
    "MTEB(deu)": {"tasks": null, "languages": "German"},
    "MTEB(pol)": {"tasks": null, "languages": "Polish"},
    "MTEB(kor)": {"tasks": null, "languages": "Korean"},
    "MTEB(Chinese)": {"tasks": null, "languages": "Chinese"}
  }
}
